{
  "persona_id": "N-03",
  "persona_name": "Structural — REST Endpoint Exerciser",
  "status": "COMPLETED",
  "trip_destination": "Spain",
  "completed_steps": ["auth", "health_endpoints", "public_endpoints", "authenticated_endpoints", "trip_sharing_lifecycle", "error_handling"],
  "bugs": [],
  "ux_issues": [],
  "ai_behavior_issues": [],
  "tool_failures": [],
  "usefulness_evaluation": {
    "overall_score": 5,
    "trip_creation_score": 5,
    "itinerary_quality_score": 0,
    "persona_handoff_score": 0,
    "booking_parsing_score": 0,
    "companion_mode_score": 0,
    "would_use_again": true,
    "narrative": "All REST endpoints behaved correctly. Health checks respond sub-millisecond. Guides API returns 25 well-structured entries with full content on detail pages. Auth enforcement is solid — all authenticated endpoints return 401 without a token. Trip sharing lifecycle works end-to-end: share generates token, public fetch works, unshare invalidates the token immediately. Error handling returns appropriate 401/404 codes with no 500s."
  },
  "feature_coverage": ["healthz", "health", "livez", "readyz", "guides_list", "guides_detail", "shared_invalid_token", "usage", "referral", "trip_share", "shared_fetch", "trip_unshare", "shared_invalidation", "usage_no_auth", "share_no_auth", "share_invalid_trip"]
}
